{
  "snapshot_id": "gvrn-1955-02-07",
  "effective_date": "1955-02-07",
  "source": {
    "site": "정부조직관리정보시스템",
    "page_url": "https://org.go.kr/oam/gvrnOrgChartView.ifrm?flag=gov",
    "endpoint": "https://org.go.kr/oam/selectGvrnOrgViewList.do",
    "date_endpoint": "https://org.go.kr/oam/selectEfYdList.do",
    "request_payload": {
      "pageName": "대국민서비스 기구도 조회",
      "efYd": "19550207"
    },
    "source_date_code": "19550207",
    "source_date_label": "정부조직법 <1955-02-07>",
    "fetched_at": "2026-07-05T06:36:39+00:00"
  },
  "node_count": 26,
  "nodes": [
    {
      "id": "0000001",
      "name": "대통령",
      "full_name": "대통령",
      "abbreviation": "",
      "english_name": "President",
      "english_abbreviation": "",
      "parent_id": null,
      "root_id": "0000001",
      "valid_from": "1955-02-07",
      "valid_to": "1956-01-31",
      "display": {
        "rank_no": "1",
        "level": "1",
        "template": "H",
        "shown_in_chart": "Y"
      },
      "classification": {
        "large": "01",
        "medium": "01",
        "small": "01",
        "chief_grade_code": "01",
        "independent": "N"
      },
      "legal_basis": [
        {
          "basis_type": "snapshot_law",
          "law_id": "001720",
          "law_name": "정부조직법",
          "effective_date": "1955-02-07",
          "law_go_kr_url": "https://www.law.go.kr/법령/정부조직법",
          "source_field": "lsNm"
        }
      ],
      "reorganization": {
        "source_value": "",
        "type": "none",
        "related_ref": ""
      },
      "source_fields": {
        "gvrnNo": 7182,
        "orgEsntlCode": 0,
        "lsiSeq": 5753,
        "lsId": "001720",
        "lsNm": "정부조직법",
        "lsiEfYd": "19550207",
        "efGubun": "1",
        "orgCode": "0000001",
        "upOrgCode": "0000001",
        "rootOrgCode": "0000001",
        "efYd": "19550207",
        "edYd": "19560131",
        "reorganCode": "",
        "relgoagCode": ""
      }
    },
    {
      "id": "1790331",
      "name": "부통령",
      "full_name": "부통령",
      "abbreviation": "",
      "english_name": "",
      "english_abbreviation": "",
      "parent_id": "0000001",
      "root_id": "0000001",
      "valid_from": "1955-02-07",
      "valid_to": "1956-01-31",
      "display": {
        "rank_no": "1",
        "level": "2",
        "template": "H",
        "shown_in_chart": "Y"
      },
      "classification": {
        "large": "04",
        "medium": "07",
        "small": "10",
        "chief_grade_code": "09",
        "independent": "N"
      },
      "legal_basis": [
        {
          "basis_type": "snapshot_law",
          "law_id": "001720",
          "law_name": "정부조직법",
          "effective_date": "1955-02-07",
          "law_go_kr_url": "https://www.law.go.kr/법령/정부조직법",
          "source_field": "lsNm"
        }
      ],
      "reorganization": {
        "source_value": "",
        "type": "none",
        "related_ref": ""
      },
      "source_fields": {
        "gvrnNo": 7214,
        "orgEsntlCode": 0,
        "lsiSeq": 5753,
        "lsId": "001720",
        "lsNm": "정부조직법",
        "lsiEfYd": "19550207",
        "efGubun": "1",
        "orgCode": "1790331",
        "upOrgCode": "0000001",
        "rootOrgCode": "0000001",
        "efYd": "19550207",
        "edYd": "19560131",
        "reorganCode": "",
        "relgoagCode": ""
      }
    },
    {
      "id": "1790329",
      "name": "심계원",
      "full_name": "심계원",
      "abbreviation": "",
      "english_name": "",
      "english_abbreviation": "",
      "parent_id": "0000001",
      "root_id": "0000001",
      "valid_from": "1955-02-07",
      "valid_to": "1956-01-31",
      "display": {
        "rank_no": "2",
        "level": "2",
        "template": "H",
        "shown_in_chart": "Y"
      },
      "classification": {
        "large": "03",
        "medium": "03",
        "small": "03",
        "chief_grade_code": "02",
        "independent": "N"
      },
      "legal_basis": [
        {
          "basis_type": "snapshot_law",
          "law_id": "001720",
          "law_name": "정부조직법",
          "effective_date": "1955-02-07",
          "law_go_kr_url": "https://www.law.go.kr/법령/정부조직법",
          "source_field": "lsNm"
        }
      ],
      "reorganization": {
        "source_value": "",
        "type": "none",
        "related_ref": ""
      },
      "source_fields": {
        "gvrnNo": 7197,
        "orgEsntlCode": 0,
        "lsiSeq": 5753,
        "lsId": "001720",
        "lsNm": "정부조직법",
        "lsiEfYd": "19550207",
        "efGubun": "1",
        "orgCode": "1790329",
        "upOrgCode": "0000001",
        "rootOrgCode": "0000001",
        "efYd": "19550207",
        "edYd": "19560131",
        "reorganCode": "",
        "relgoagCode": ""
      }
    },
    {
      "id": "1790361",
      "name": "감찰원",
      "full_name": "감찰원",
      "abbreviation": "",
      "english_name": "",
      "english_abbreviation": "",
      "parent_id": "0000001",
      "root_id": "0000001",
      "valid_from": "1955-02-07",
      "valid_to": "1956-01-31",
      "display": {
        "rank_no": "3",
        "level": "2",
        "template": "H",
        "shown_in_chart": "Y"
      },
      "classification": {
        "large": "03",
        "medium": "03",
        "small": "03",
        "chief_grade_code": "09",
        "independent": "N"
      },
      "legal_basis": [
        {
          "basis_type": "snapshot_law",
          "law_id": "001720",
          "law_name": "정부조직법",
          "effective_date": "1955-02-07",
          "law_go_kr_url": "https://www.law.go.kr/법령/정부조직법",
          "source_field": "lsNm"
        }
      ],
      "reorganization": {
        "source_value": "",
        "type": "none",
        "related_ref": ""
      },
      "source_fields": {
        "gvrnNo": 7794,
        "orgEsntlCode": 0,
        "lsiSeq": 5753,
        "lsId": "001720",
        "lsNm": "정부조직법",
        "lsiEfYd": "19550207",
        "efGubun": "1",
        "orgCode": "1790361",
        "upOrgCode": "0000001",
        "rootOrgCode": "0000001",
        "efYd": "19550207",
        "edYd": "19560131",
        "reorganCode": "",
        "relgoagCode": ""
      }
    },
    {
      "id": "1790351",
      "name": "구황실재산사무총국",
      "full_name": "구황실재산사무총국",
      "abbreviation": "",
      "english_name": "",
      "english_abbreviation": "",
      "parent_id": "0000001",
      "root_id": "0000001",
      "valid_from": "1955-02-07",
      "valid_to": "1956-01-31",
      "display": {
        "rank_no": "3",
        "level": "3",
        "template": "H",
        "shown_in_chart": "Y"
      },
      "classification": {
        "large": "03",
        "medium": "04",
        "small": "",
        "chief_grade_code": "09",
        "independent": "N"
      },
      "legal_basis": [
        {
          "basis_type": "snapshot_law",
          "law_id": "001720",
          "law_name": "정부조직법",
          "effective_date": "1955-02-07",
          "law_go_kr_url": "https://www.law.go.kr/법령/정부조직법",
          "source_field": "lsNm"
        }
      ],
      "reorganization": {
        "source_value": "",
        "type": "none",
        "related_ref": ""
      },
      "source_fields": {
        "gvrnNo": 7468,
        "orgEsntlCode": 0,
        "lsiSeq": 5753,
        "lsId": "001720",
        "lsNm": "정부조직법",
        "lsiEfYd": "19550207",
        "efGubun": "1",
        "orgCode": "1790351",
        "upOrgCode": "0000001",
        "rootOrgCode": "0000001",
        "efYd": "19550207",
        "edYd": "19560131",
        "reorganCode": "",
        "relgoagCode": ""
      }
    },
    {
      "id": "1790339",
      "name": "공보실",
      "full_name": "공보실",
      "abbreviation": "",
      "english_name": "",
      "english_abbreviation": "",
      "parent_id": "0000001",
      "root_id": "0000001",
      "valid_from": "1955-02-07",
      "valid_to": "1956-01-31",
      "display": {
        "rank_no": "3",
        "level": "3",
        "template": "H",
        "shown_in_chart": "Y"
      },
      "classification": {
        "large": "03",
        "medium": "03",
        "small": "02",
        "chief_grade_code": "03",
        "independent": "N"
      },
      "legal_basis": [
        {
          "basis_type": "snapshot_law",
          "law_id": "001720",
          "law_name": "정부조직법",
          "effective_date": "1955-02-07",
          "law_go_kr_url": "https://www.law.go.kr/법령/정부조직법",
          "source_field": "lsNm"
        }
      ],
      "reorganization": {
        "source_value": "",
        "type": "none",
        "related_ref": ""
      },
      "source_fields": {
        "gvrnNo": 7199,
        "orgEsntlCode": 0,
        "lsiSeq": 5753,
        "lsId": "001720",
        "lsNm": "정부조직법",
        "lsiEfYd": "19550207",
        "efGubun": "1",
        "orgCode": "1790339",
        "upOrgCode": "0000001",
        "rootOrgCode": "0000001",
        "efYd": "19550207",
        "edYd": "19560131",
        "reorganCode": "",
        "relgoagCode": ""
      }
    },
    {
      "id": "1790350",
      "name": "관재청",
      "full_name": "관재청",
      "abbreviation": "",
      "english_name": "",
      "english_abbreviation": "",
      "parent_id": "0000001",
      "root_id": "0000001",
      "valid_from": "1955-02-07",
      "valid_to": "1956-01-31",
      "display": {
        "rank_no": "4",
        "level": "3",
        "template": "H",
        "shown_in_chart": "Y"
      },
      "classification": {
        "large": "03",
        "medium": "03",
        "small": "07",
        "chief_grade_code": "03",
        "independent": "N"
      },
      "legal_basis": [
        {
          "basis_type": "snapshot_law",
          "law_id": "001720",
          "law_name": "정부조직법",
          "effective_date": "1955-02-07",
          "law_go_kr_url": "https://www.law.go.kr/법령/정부조직법",
          "source_field": "lsNm"
        }
      ],
      "reorganization": {
        "source_value": "",
        "type": "none",